{
  "schemaVersion": "haifa.customer-demo.evidence-bundle/v1",
  "demoId": "DEMO-V0",
  "oracle": {
    "path": "contracts/customer-demo/customer-demo-v0-oracle.json",
    "sha256": "b202987fd602b8341020ada6f3b809cdc2d3b9d673472255da9b994623404a38"
  },
  "mainSha": "c112012e147cc11daec891af3d602aeefcdff1de",
  "frozenFrontendSha": "e545c28ac301e6f9feae247c513d8ea8f83df294",
  "sdkVersion": "0.1.2-SNAPSHOT",
  "model": {
    "id": "main-deepseek",
    "provider": "openai-compatible",
    "endpointHost": "api.deepseek.com",
    "credentialSource": "os",
    "secretPresent": false,
    "paidModelCalled": true
  },
  "budget": {
    "authorized": true,
    "maxModelCallsPerRound": 3,
    "authorizationRef": "operator-standing-authorization-2026-09-27"
  },
  "dataRoot": "D:\\workspace\\haifa-agent-super-harness\\local-tmp\\m4-main-c112012-20260928-data",
  "dataRootPolicy": "preserve-between-rounds",
  "roundResetBetweenRounds": false,
  "configSha256": "fa705fc7aa84fd4f185e1ebeb004949c57b98af294eccd504366245389d6dd9a",
  "inputSha256": null,
  "referenceFallbackEvidence": {
    "fallbackAllowed": false,
    "fallbackUsed": false,
    "evidencePath": "local-tmp/m4-main-c112012-20260928-evidence/test-results/m4-live-M4-real-DeepSeek-f-f0a83-ecutive-rounds-zero-retries/m4-two-round-results.json",
    "evidenceSha256": "360fb656906bdead4294924cc14b48e8ec894ad08968004462d28513e6bc7ec1"
  },
  "rounds": [
    {
      "index": 1,
      "sequence": 1,
      "status": "PASS",
      "modelId": "main-deepseek",
      "mainSha": "c112012e147cc11daec891af3d602aeefcdff1de",
      "frozenFrontendSha": "e545c28ac301e6f9feae247c513d8ea8f83df294",
      "sdkVersion": "0.1.2-SNAPSHOT",
      "configSha256": "fa705fc7aa84fd4f185e1ebeb004949c57b98af294eccd504366245389d6dd9a",
      "inputSha256": "40beb10a108cac09bee86458d411688dab3ab7f562b154f7a3fad01f0826db21",
      "dataRoot": "D:\\workspace\\haifa-agent-super-harness\\local-tmp\\m4-main-c112012-20260928-data",
      "threadId": "d0356e49-52ee-4a69-b92d-9153c7a4df29",
      "runId": "01a0e5d2-29cb-7bab-be9d-d17819ef450e",
      "toolCallId": "01a0e5d2-382e-74b3-8ccd-69b76f660b24",
      "interactionId": "01a0e5d2-3b8f-7280-941a-d6780690d17f",
      "artifactId": "d72077c7-2067-4bea-be3e-0b954d5ac6db",
      "fileName": "customer-demo-round-1.txt",
      "fileSha256": "aee4acb8f114a98feb2ce8a193e3dc07bc75d79ee43c4c8ef525f5fff0127935",
      "artifactProvenance": "sdk-owned-real-artifact",
      "artifactProvenanceEvidence": {
        "path": "contracts/customer-demo/evidence/m4-round-1-provenance.json",
        "sha256": "0aebc513dcae25bdee22abfa7e1ec88e338a3fd03d28c1a4afed14e7fea4a289"
      },
      "downloadSha256": "aee4acb8f114a98feb2ce8a193e3dc07bc75d79ee43c4c8ef525f5fff0127935",
      "downloadByteCount": 27,
      "downloadEvidence": {
        "path": "contracts/customer-demo/evidence/m4-round-1-downloaded.txt",
        "sha256": "aee4acb8f114a98feb2ce8a193e3dc07bc75d79ee43c4c8ef525f5fff0127935"
      },
      "approvalBefore": "pending",
      "approvalAfter": "approved",
      "steer": {
        "targetRunId": "01a0e5d2-29cb-7bab-be9d-d17819ef450e",
        "request": "请在同一 Run 中把最终回答补充为：DEMO-STEER-ACK-1，不要再次调用 write_file。",
        "response": "HTTP 200; same Run 01a0e5d2-29cb-7bab-be9d-d17819ef450e",
        "ackText": "DEMO-STEER-ACK-1",
        "sameRun": true
      },
      "networkTargets": [
        "http://127.0.0.1:33018",
        "https://api.deepseek.com"
      ],
      "usage": {
        "status": "success",
        "inputTokens": 2670,
        "outputTokens": 224,
        "totalTokens": 2894,
        "modelCalls": 3
      },
      "timeline": [
        {
          "at": "2026-09-28T02:22:24.755Z",
          "event": "frozen UI new Thread / real DeepSeek Run started"
        },
        {
          "at": "2026-09-28T02:22:40.957Z",
          "event": "pending Approval survived reload; approved same Run; preapproval Artifact HTTP 404"
        },
        {
          "at": "2026-09-28T02:22:54.461Z",
          "event": "single production write_file and Artifact; active same-Run Steer acknowledged; UI download SHA matched; Run success"
        }
      ],
      "playwrightPath": "local-tmp/m4-main-c112012-20260928-evidence/test-results/m4-live-M4-real-DeepSeek-f-f0a83-ecutive-rounds-zero-retries/trace.zip",
      "playwrightSha256": "f029ba287eaa789e4bc807f52429f09c993d4729822a598ad19840c8be59d9ab",
      "logPaths": [
        {
          "path": "local-tmp/m4-main-c112012-20260928-evidence/test-results/m4-live-M4-real-DeepSeek-f-f0a83-ecutive-rounds-zero-retries/round-1-result.json",
          "sha256": "bffc2c4e7c22ffcfb760a743c9dd50c7cee72959b979dd7e6a8e15c35a778af7"
        },
        {
          "path": "local-tmp/m4-main-c112012-20260928-evidence/m4-playwright-first-attempt.log",
          "sha256": "f86d79fe3f60f986611e16bd68980c1fce470bb8152c4f5690dcbd076d5bfca0"
        },
        {
          "path": "local-tmp/m4-main-c112012-20260928-evidence/service-logs-snapshot/frontend-20260928-101039.err.log",
          "sha256": "6f3cd54a429f0e8a2e0f1fc48e76366bb99b7f09e071a2d841d7511bf2b3a713"
        }
      ],
      "processCleanup": {
        "portsReleased": true,
        "processes": [
          "Playwright-owned worker exited and no child-slot listeners remained; main Gateway 18018 / Frontend 33018 deliberately retained for human acceptance"
        ]
      },
      "attempts": 1,
      "hiddenRetry": false,
      "firstFailure": null
    },
    {
      "index": 2,
      "sequence": 2,
      "status": "PASS",
      "modelId": "main-deepseek",
      "mainSha": "c112012e147cc11daec891af3d602aeefcdff1de",
      "frozenFrontendSha": "e545c28ac301e6f9feae247c513d8ea8f83df294",
      "sdkVersion": "0.1.2-SNAPSHOT",
      "configSha256": "fa705fc7aa84fd4f185e1ebeb004949c57b98af294eccd504366245389d6dd9a",
      "inputSha256": "cd76e3f38534a7bd632e9fb61783045c6ea98674f242c8d5145307d19032f27e",
      "dataRoot": "D:\\workspace\\haifa-agent-super-harness\\local-tmp\\m4-main-c112012-20260928-data",
      "threadId": "953196e2-91d6-4939-a371-cb02c034f02b",
      "runId": "01a0e5d2-979e-7a78-9b61-0e22cae15d91",
      "toolCallId": "01a0e5d2-a0b3-7b3b-bb5b-bc693853875a",
      "interactionId": "01a0e5d2-a2a8-7fd6-a69e-d55bb84cfc39",
      "artifactId": "40ec1c85-e058-41df-96eb-69836d357d28",
      "fileName": "customer-demo-round-2.txt",
      "fileSha256": "e6d897a0d0297e1f32a78eb1abeec1ed0192b01b9a01642d0f6ef42e4059bf5d",
      "artifactProvenance": "sdk-owned-real-artifact",
      "artifactProvenanceEvidence": {
        "path": "contracts/customer-demo/evidence/m4-round-2-provenance.json",
        "sha256": "43965c26be8cc9b5b9b850205abbc3d9eba1992b855648d1ddca00a252b2931a"
      },
      "downloadSha256": "e6d897a0d0297e1f32a78eb1abeec1ed0192b01b9a01642d0f6ef42e4059bf5d",
      "downloadByteCount": 27,
      "downloadEvidence": {
        "path": "contracts/customer-demo/evidence/m4-round-2-downloaded.txt",
        "sha256": "e6d897a0d0297e1f32a78eb1abeec1ed0192b01b9a01642d0f6ef42e4059bf5d"
      },
      "approvalBefore": "pending",
      "approvalAfter": "approved",
      "steer": {
        "targetRunId": "01a0e5d2-979e-7a78-9b61-0e22cae15d91",
        "request": "请在同一 Run 中把最终回答补充为：DEMO-STEER-ACK-2，不要再次调用 write_file。",
        "response": "HTTP 200; same Run 01a0e5d2-979e-7a78-9b61-0e22cae15d91",
        "ackText": "DEMO-STEER-ACK-2",
        "sameRun": true
      },
      "networkTargets": [
        "http://127.0.0.1:33018",
        "https://api.deepseek.com"
      ],
      "usage": {
        "status": "success",
        "inputTokens": 2689,
        "outputTokens": 212,
        "totalTokens": 2901,
        "modelCalls": 3
      },
      "timeline": [
        {
          "at": "2026-09-28T02:22:54.568Z",
          "event": "frozen UI new Thread / real DeepSeek Run started"
        },
        {
          "at": "2026-09-28T02:23:08.117Z",
          "event": "pending Approval survived reload; approved same Run; preapproval Artifact HTTP 404"
        },
        {
          "at": "2026-09-28T02:23:22.353Z",
          "event": "single production write_file and Artifact; active same-Run Steer acknowledged; UI download SHA matched; Run success"
        }
      ],
      "playwrightPath": "local-tmp/m4-main-c112012-20260928-evidence/test-results/m4-live-M4-real-DeepSeek-f-f0a83-ecutive-rounds-zero-retries/trace.zip",
      "playwrightSha256": "f029ba287eaa789e4bc807f52429f09c993d4729822a598ad19840c8be59d9ab",
      "logPaths": [
        {
          "path": "local-tmp/m4-main-c112012-20260928-evidence/test-results/m4-live-M4-real-DeepSeek-f-f0a83-ecutive-rounds-zero-retries/round-2-result.json",
          "sha256": "8e1a330710b21b6f885d1edc9cb9524043ffdb4f1e45dfa3f47ec6362a73a021"
        },
        {
          "path": "local-tmp/m4-main-c112012-20260928-evidence/m4-playwright-first-attempt.log",
          "sha256": "f86d79fe3f60f986611e16bd68980c1fce470bb8152c4f5690dcbd076d5bfca0"
        },
        {
          "path": "local-tmp/m4-main-c112012-20260928-evidence/service-logs-snapshot/frontend-20260928-101039.err.log",
          "sha256": "6f3cd54a429f0e8a2e0f1fc48e76366bb99b7f09e071a2d841d7511bf2b3a713"
        }
      ],
      "processCleanup": {
        "portsReleased": true,
        "processes": [
          "Playwright-owned worker exited and no child-slot listeners remained; main Gateway 18018 / Frontend 33018 deliberately retained for human acceptance"
        ]
      },
      "attempts": 1,
      "hiddenRetry": false,
      "firstFailure": null
    }
  ],
  "firstFailureHistory": [
    {
      "id": "w05-first-steer-gap",
      "stage": "M1",
      "summary": "W05 首轮合并态整仓出现 Steer SSE gap FAIL；随后定向与第二轮 PASS。",
      "originalAvailable": false,
      "evidencePath": null,
      "evidenceSha256": null,
      "note": "终端/看板摘要，非原件；原始 surefire 报告已随后续 clean 删除。"
    },
    {
      "id": "w00-first-surefire",
      "stage": "M0",